{
  "$schema": "https://json-schema.org/draft/2020-12/schema",
  "$id": "https://get-paper-done.local/schemas/state.schema.json",
  "title": "GPD State",
  "type": "object",
  "additionalProperties": false,
  "required": [
    "version",
    "status",
    "current_stage",
    "last_completed_stage",
    "last_activity",
    "suggested_next_command",
    "blocked_by",
    "grill",
    "strategy",
    "feedback",
    "post_import_choices"
  ],
  "properties": {
    "version": { "type": "integer", "enum": [1] },
    "status": { "type": "string", "minLength": 1 },
    "current_stage": { "type": "string", "minLength": 1 },
    "last_completed_stage": { "type": "string", "minLength": 1 },
    "last_activity": { "type": "string", "minLength": 1 },
    "suggested_next_command": {
      "type": "string",
      "minLength": 1,
      "pattern": "^/gpd-[a-z0-9-]+(?:\\s+.*)?$"
    },
    "blocked_by": {
      "type": "array",
      "items": { "type": "string" }
    },
    "grill": {
      "type": "object",
      "additionalProperties": false,
      "required": ["status", "completion_basis", "resolved_decisions"],
      "properties": {
        "status": {
          "type": "string",
          "enum": ["Not Started", "In Progress", "Complete"]
        },
        "completion_basis": { "type": "string" },
        "resolved_decisions": {
          "type": "array",
          "items": {
            "type": "string",
            "enum": [
              "paper_job",
              "primary_reader",
              "belief_shift",
              "thesis",
              "narrative_spine",
              "key_terms",
              "scope_boundary",
              "proof_standard",
              "strongest_counterargument",
              "non_goals"
            ]
          }
        }
      }
    },
    "strategy": {
      "type": "object",
      "additionalProperties": false,
      "required": [
        "status",
        "blocking_issues",
        "primary_blocker",
        "block_severity",
        "required_unblock_action"
      ],
      "properties": {
        "status": {
          "type": "string",
          "enum": ["Go", "Revise Before Drafting", "No-Go"]
        },
        "blocking_issues": {
          "type": "array",
          "items": {
            "type": "string",
            "enum": [
              "none",
              "scope_too_broad",
              "thesis_weak",
              "audience_unclear",
              "audience_conflict",
              "evidence_gap",
              "weak_ask",
              "poor_posture",
              "missing_outcome",
              "reader_promise_weak",
              "decision_usefulness_weak"
            ]
          }
        },
        "primary_blocker": {
          "type": "string",
          "enum": [
            "none",
            "scope_too_broad",
            "thesis_weak",
            "audience_unclear",
            "audience_conflict",
            "evidence_gap",
            "weak_ask",
            "poor_posture",
            "missing_outcome",
            "reader_promise_weak",
            "decision_usefulness_weak"
          ]
        },
        "block_severity": {
          "type": "string",
          "enum": ["None", "Medium", "High"]
        },
        "required_unblock_action": {
          "type": "string",
          "enum": [
            "none",
            "brief_revision",
            "audience_revision",
            "thesis_revision",
            "scope_narrowing",
            "research_plan",
            "user_override"
          ]
        }
      }
    },
    "feedback": {
      "type": "object",
      "additionalProperties": false,
      "required": ["feedback_plan_status", "approved_handling"],
      "properties": {
        "feedback_plan_status": {
          "type": "string",
          "enum": [
            "Not created",
            "Pending user approval",
            "Approved",
            "Approved by user",
            "Applied",
            "Needs revision",
            "Ignored"
          ]
        },
        "approved_handling": { "type": "string" }
      }
    },
    "versioning": {
      "type": "object",
      "additionalProperties": false,
      "required": ["last_snapshot_id", "last_export_snapshot_id"],
      "properties": {
        "last_snapshot_id": { "type": "string" },
        "active_revision_snapshot_id": { "type": "string" },
        "last_export_snapshot_id": { "type": "string" },
        "last_restore_snapshot_id": { "type": "string" },
        "last_exported_draft_sha256": { "type": "string" },
        "last_exported_final_sha256": { "type": "string" }
      }
    },
    "accepted": {
      "type": ["object", "null"],
      "additionalProperties": false,
      "required": [
        "version",
        "accepted_at",
        "source_artifact",
        "accepted_path",
        "accepted_sha256",
        "source_sha256",
        "draft_sha256",
        "final_sha256"
      ],
      "properties": {
        "version": { "type": "integer", "enum": [1] },
        "accepted_at": { "type": "string" },
        "source_artifact": { "type": "string" },
        "accepted_path": { "type": "string" },
        "accepted_sha256": { "type": "string" },
        "source_sha256": { "type": "string" },
        "draft_sha256": { "type": "string" },
        "final_sha256": { "type": "string" }
      }
    },
    "import_mode": {
      "type": ["object", "null"],
      "additionalProperties": false,
      "required": [
        "detected",
        "confirmed",
        "authored_prose_detected",
        "confirmation_required",
        "confirmation",
        "signals"
      ],
      "properties": {
        "detected": {
          "type": "string",
          "enum": ["preserve-and-strengthen", "generate-from-brief", "convert-format"]
        },
        "confirmed": {
          "type": "string",
          "enum": ["preserve-and-strengthen", "generate-from-brief", "convert-format"]
        },
        "authored_prose_detected": { "type": "boolean" },
        "confirmation_required": { "type": "boolean" },
        "confirmation": {
          "type": "string",
          "enum": ["not_required", "confirmed_by_flag"]
        },
        "signals": {
          "type": "object",
          "additionalProperties": false,
          "required": [
            "prose_words",
            "bullet_words",
            "prose_ratio",
            "heading_count",
            "non_list_paragraphs",
            "thesis_like_opening"
          ],
          "properties": {
            "prose_words": { "type": "integer" },
            "bullet_words": { "type": "integer" },
            "prose_ratio": { "type": "number" },
            "heading_count": { "type": "integer" },
            "non_list_paragraphs": { "type": "integer" },
            "thesis_like_opening": { "type": "boolean" }
          }
        }
      }
    },
    "post_import_choices": {
      "type": "array",
      "items": { "type": "string" }
    }
  }
}
