{
  "version": 1,
  "status": "Initialized",
  "current_stage": "Strategy Gate",
  "last_completed_stage": "Setup",
  "last_activity": "[timestamp]",
  "suggested_next_command": "/gpd-grill",
  "blocked_by": [],
  "grill": {
    "status": "Not Started",
    "completion_basis": "",
    "resolved_decisions": []
  },
  "strategy": {
    "status": "Revise Before Drafting",
    "blocking_issues": [
      "thesis_weak",
      "audience_unclear",
      "missing_outcome"
    ],
    "primary_blocker": "thesis_weak",
    "block_severity": "Medium",
    "required_unblock_action": "brief_revision"
  },
  "feedback": {
    "feedback_plan_status": "Not created",
    "approved_handling": ""
  },
  "versioning": {
    "last_snapshot_id": "",
    "active_revision_snapshot_id": "",
    "last_export_snapshot_id": "",
    "last_restore_snapshot_id": "",
    "last_exported_draft_sha256": "",
    "last_exported_final_sha256": ""
  },
  "accepted": null,
  "import_mode": null,
  "post_import_choices": []
}
